title,company,location,description,url,technologies,salary,level
AI integrator,Копійочка,,"Все почалося 15 років тому з ідеї відкрити магазин, у якому кожен товар дивуватиме покупця та даруватиме нові враження. Зараз мережа «Копійочка» налічує 500 магазинів у 16 областях України, а в нашій команді — більш ніж 3000 дивотворців. Ми шукаємо проактивного АІ-аналітика/інтегратора (на офісний форматроботи), який вміє перетворювати бізнес-завдання у швидкі прототипи, експериментувати з моделями та доводити ідеї до робочих MVP. Ти станеш ключовим учасником АІ-напрямку — тестуватимеш гіпотези, працюватимеш з Data Scientist’ами та допомагатимеш довести їхні моделі до реальних продуктів.Очікування від тебе:
вміння працювати з промптами

знання Python, досвід із FastAPI, LangChain, OpenAI API буде перевагою
розуміння архітектури LLM / RAG, базових ML-концепцій буде перевагою
досвід створення інтерактивних демо або веб-додатків (Streamlit, Gradio, Vue) буде перевагою
самостійність, ініціативність, здатність швидко експериментувати. 
Що буде у твоїх руках (і серці 😊):Основні завдання
Пошук ідей та створення MVP-рішень
Аналіз бізнес-процесів, пошук кейсів для автоматизації за допомогою ШІ.
Розробка швидких прототипів (chatbot, RAG, OCR, класифікація документів, аналітичні панелі тощо).
Тестування гіпотез, підготовка демонстрацій та Proof-of-Concept.

Організація збору і структурування даних
Створення скриптів і пайплайнів для збору/очищення даних (API, web, бази).
Робота з текстами, зображеннями, PDF, табличними даними.
Побудова баз знань (векторні бази, embedding, RAG-архітектури).

Співпраця з Data Science командою
Інтеграція прогнозних моделей (ML, Time Series, NLP) у додатки.
Взаємодія при передачі даних, тестуванні й адаптації результатів моделей

Буде перевагою
Досвід впровадження ШІ-рішень

Досвід у NLP / OCR / Computer Vision.
Розуміння пайплайнів даних (ETL/ELT, Prefect, Airflow).
Знання векторних баз (Qdrant, Chroma, Weaviate, Pinecone).
Досвід із GCP/AWS або локальними GPU-серверами.
Очікувані результати
Досвід роботи з MVP або готові рішення у відкритому доступі 
Наявність прототипів, готових до інтеграції у продакшн.
Побудований базовий пайплайн збору й очищення даних.
З нами ти отримаєш:Фінансову стабільність: своєчасні виплати і регулярні підвищення зарплатиПовагу до твого часу: стабільний графік з Пн — Пт, з 9:00 до 18:00Розвиток: компенсуємо цільове навчання та надаємо доступ до корпоративної бібліотекиТурботу про здоров’я: безкоштовні заняття фітнесом тричі на тижденьА ще ми — класні, бо:Відкриваємо кар'єрні можливості — більшість наших керівників зросли всередині компаніїМаємо приємні бонуси для команди: ексклюзивні умови в програмі лояльності «Копійочка»Піклуємось про країну і людей — допомагаємо військовим, підтримуємо мобілізованих співробітників.Маємо теплу корпоративну культуру: зможеш проявити себе у конкурсах, майстер-класах та інших командних подіях.Якщо всередині щось тенькнуло — не ігноруй, відгукнись!Більше можливостей у «Копійочка» шукай на нашому сайті. Не знайшов актуальну вакансію? Тоді надсилай резюме на, щоб потрапити в резерв та першим дізнатись про нову вакансію!",https://www.work.ua/jobs/7405246/,"['AWS', 'FastAPI', 'GCP', 'LangChain', 'Python']",,
"Project Manager, Python Backend Developer",Trust,,"Undertalk — це компанія, яка займається аутсорсингом відділу продажів для товарного бізнесу. Простіше кажучи, це колл-центр. Наша суть і унікальна торгова пропозиція полягає в тому, що ми робимо продажі краще, ніж власний відділ продажів клієнта.На даний момент ми в пошуках проактивного ІТ-Project Mamagerа з досвідом в розробці (Bаckend). Обовʼязки будуть 50\50 повʼязані з даними посадами.Коротко про першочергові завдання:1 — Оцифрування робочих процесів компанії, включно з інтерграціями CRM-систем (LP-CRM і SalesDrive);2 — AI-бот для месенджерів.Основні обовʼязки:
Оцінка задач, поставлених керівником та підбір необхідних виконавців;
Комунікація та контроль виконання задач командою;
Дотримання дедлайнів особистих та найнятих працівників;
Навички та вміння програмування на мові Python;
Що ми пропонуємо:
Вільний та гнучкий графік, працюємо на результат;
Достойний рівень ЗП та своєчасні виплати (ставка + %);
Можливість формувати власну команду спеціалістів.
Наші побажання до тебе:
Досвід роботи в команді на аналогічній посаді 2 роки +;
Системне мислення;
Знання архітектурних патернів та кращих практик програмування;
Вміння будувати розширювані та стійкі системи, 
Вміння вирішувати проблеми, які виникають в ході виконання проекту.
Технологічний стек: Python, FastAPI, PostgreSQL, Docker, S3, Celery, Scraping, third party integration, Rabbit MQ, event driven actions, тестування е2е, юніт тести (pytest), Cursor/Copilot/Claude Code. Для комунікації з рекрутером звертайтесь до @hr_Olenaa",https://www.work.ua/jobs/7639051/,"['Celery', 'Docker', 'FastAPI', 'PostgreSQL', 'PyTest', 'Python', 'SQL']",70000.0,
Computer Vision Engineer (Python),Digital Transformation OCS,,"Вакансія: Computer Vision Engineer (Python)Партайм / Проектна робота, ВіддаленоМи розробляємо власний AI продукт у сфері відеоаналітики. Масштабуємось і шукаємо CV спеціалістів для роботи над кастомними проєктами. Формат переважно партайм але є і повноцінні проєкти на фултайм зайнятість. Що будеш робити:
Fine-tuning і розробка моделей для детекції дій і подій на відео

Інтеграція моделей в існуючу інфраструктуру (Python, FastAPI, Docker)
Робота з відео потоками з IP камер (RTSP, FFmpeg, OpenCV)
Кастомні рішення під конкретні задачі клієнтів
Що шукаємо:
Python, PyTorch або TensorFlow
OpenCV, робота з відео
Досвід з YOLO або іншими детекторами
Деплой моделей (FastAPI, Docker)
Плюсом: CLIP, Florence-2, VideoMAE, Whisper, досвід fine-tuning на кастомних датасетах, CUDAЩоб відгукнутись — заповни форму: https://docs.google.com/forms/d/e/1FAIpQLSdHD1rpPrTSrhWC00nqW6oAEgOmEg7a3L4O4_ikLz7pjm8tLA/viewform?usp=header",https://www.work.ua/jobs/7865349/,"['Docker', 'FastAPI', 'PyTorch', 'Python', 'TensorFlow']",,Senior
Junior Python Developer,HYS Enterprise,,"We are looking for an enthusiastic and proactivePython Developer with commercial experience to join our dynamic team.About the project:Join Epicstaff — our open-source startup building a platform for creating AI agents with a visual UI and modular backend. Check it out at GitHub and make sure you understand what it’s about. If it clicks with you — welcome aboard, and let’s build something great together. No micromanagement. Just clear goals, smart teammates, and your chance to make a real impact on a real product.You need to have:
1+ years of experience in Python development;
Strong proficiency in Python and Django framework;
Solid understanding of software development core concepts: data structures, algorithms, OOP, and Asynchronous programming (Asyncio);
Experience working with SQL (PostgreSQL/MySQL) and NoSQL databases;
Hands-on experience with Linux environments and version control (Git);
Ability to write clean, maintainable, and efficient code;
Upper-Intermediate English level or higher (ability to communicate effectively with stakeholders).
Would Be a Plus:
Practical experience with ML, LLMs (OpenAI, Anthropic, etc.), and RAG;
Deep passion for the AI ecosystem;
Experience with Docker and CI/CD pipelines.
In this project, you will:
Contribute to technical solutions and write clean, maintainable, and high-quality Python code for our modular backend;
Participate in debugging and troubleshooting a multi-agent virtual assistant system;
Create and maintain clear technical documentation;
Join conference calls and meetings with stakeholders when required;
Participate in estimation, grooming, and planning sessions.
Our selection process includes:
To submit your application, please follow the link below and fill out the form at the provided link — https://hysenterprise.hurma.work/public-vacancies/359?source=Mg==&utm_source=work_ua 
HR interview;
Tech interview;
Final interview with the founders of the company.
We offer:
Monday—Friday (10.00−19.00 or 9:00−18.00) schedule;
Work format: office/remote/hybrid;
Medical insurance;
Corporate equipment;
No time trackers or unnecessary bureaucracy;
Supportive and collaborative team culture;
Paid vacation and sick leave;
Gifts for birthdays and professional holidays;
Freedom to test ideas, lead initiatives, and try something new;
Communication with experienced professionals eager to share their expertise;
Participation in internal and external events, with opportunities to grow your brand.",https://www.work.ua/jobs/7804785/,"['CI/CD', 'Django', 'Docker', 'Git', 'GitHub', 'Linux', 'NoSQL', 'PostgreSQL', 'Python', 'SQL', 'asyncio']",,Intern
"Python Developer, інтегратор (Automations, Telegram Bots, API, AI)",SoftBam,,"Ми — команда розробників, що працює з інфраструктурою та автоматизацією процесів для медіабаїнгових (арбітражних) команд.Шукаємо python разробника/інтегратора, який буде відповідати за автоматизацію процесів, розробку телеграм ботів, інтеграцію сервісівТобі до нас, якщо ти любиш автоматизувати рутину, працювати з API, Telegram-ботами та серверами, і хочеш будувати зрозумілі, стабільні технічні рішення Обовʼязки:
Розробка, налаштування та підтримка Telegram-ботів на Python 
Інтеграція Telegram-ботів з API, Google sheets
Розробка скриптів в гугл таблицях App Script
Налаштування та інтеграція різних технологій і сервісів між собою
Вимоги:
Досвід роботи з Python від 1 року
Досвід роботи з Telegram-ботами, юзер ботами (aiogram / pyrogram або аналогами)
Базове розуміння роботи з базами даних
Розуміння принципів роботи API (REST, webhooks)
Базове розуміння роботи серверів (Linux, VPS)
Вміння швидко розбиратись у нових сервісах та технологіях
Буде плюсом:
Досвід роботи з Mongodb
Досвід роботи з Google Sheets API / Google Apps Script
Досвід роботи з Docker, cron, systemd
Ми пропонуємо:
Повний ремоут
Фулл тайм
Стабільну оплату + бонуси за ефективність
Тестовий місяць — $700, далі — $1100
Навчання та підтримку на старті
Роботу в дружній команді без токсичності й бюрократі
Регулярний перегляд зп
Надішліть резюме або звертайтесь у Telegram: @softbam_andrii",https://www.work.ua/jobs/7862007/,"['Docker', 'Linux', 'MongoDB', 'Python', 'REST API']",39000.0,
Python-розробник (Odoo) в батальйон безпілотних систем,"Tenrai, батальйон безпілотних систем 158 ОМБр",,"Привіт! Ми — TENRAI [ТЕНРАЙ], батальйон безпілотних систем 158 ОМБр, що керує стихією на полі бою. Ми створені для нових викликів війни і використовуємо передові безпілотні технології, щоб забезпечити максимальну безпеку наших людей та ефективність операцій. Якщо ти хочеш долучитися до команди, яка впроваджує інновації у розвідку, коригування вогню та ударні операції — ця можливість для тебе.Що очікуємо від тебе на посаді Python (Odoo) розробника:
Розробка і підтримка програмних рішень на базі Python, зокрема у системі Odoo, для автоматизації процесів у батальйоні.
Впровадження нових функціональних можливостей, оптимізація існуючих модулів і інтеграція з іншими системами.
Тестування, аналіз та усунення технічних проблем для забезпечення стабільної роботи програмного забезпечення.
Тісна співпраця з командою, щоб розуміти задачі та трансформувати їх у ефективні технічні рішення.
Забезпечення безпеки даних і відповідність розробок до високих стандартів військових операцій.
Твої ключові задачі:
Розробка і підтримка кастомізованих модулів в Odoo.
Автоматизація внутрішніх процесів батальйону.
Оптимізація і масштабування програмних продуктів.
Участь у створенні унікальних рішень для підвищення ефективності бойових операцій.
Ми шукаємо саме тебе, якщо:
Маєш досвід розробки на Python від 2 років.
Працював з Odoo або подібними ERP-системами.
Володієш знаннями баз даних, API та інтеграцій.
Відповідально ставишся до якості коду та безпеки.
Цінуєш командну роботу і розумієш важливість своєї ролі для безпеки та успіху операцій.
Якщо ти готовий долучитися до TENRAI і своїми знаннями та навичками допомагати робити небезпеку передбачуваною — чекаємо на твою заявку. Разом ми сильніші!",https://www.work.ua/jobs/7698330/,"['Odoo', 'Python']",,
Програміст Python для Odoo,"Тюфанов С.Г., ФОП",Харків,"Ми — український бренд одягу Reload. Шукаємо талановитого та мотивованого програміста Python для розвитку та підтримки нашої системи управління бізнесом на базі Odoo.Обов’язки:
Розробка та модифікація функціоналу системи Odoo;
Встановлення, налаштування та підтримка роботи модулів Odoo;
Розробка та впровадження нових функціональних можливостей у систему;
Відлагодження та тестування розробленого програмного забезпечення;
Вимоги:
Досвід роботи з мовою програмування Python;
Розуміння основ розробки на базі Odoo або готовність швидко набути такого досвіду;
Вміння працювати в команді та гнучкість у роботі;
Висока самоорганізованість та вміння працювати в умовах високого темпу розвитку проекту;
Креативність та ініціативність у вирішенні завдань.
Ми пропонуємо: 
Можливість зростання та професійного розвитку;
Конкурентну заробітну плату;
Гнучкий графік роботи;
Комфортні умови праці та дружню атмосферу в колективі.
Якщо ви маєте бажання розвиватися в сфері програмування Python та Odoo, маєте комунікабельність та готовність працювати у команді, надсилайте своє резюме.",https://www.work.ua/jobs/4334775/,"['Odoo', 'Python']",,
Інженер-програміст БПЛА,"Буревій, перша Президентська бригада НГУ (в/ч 3027)",,"Вимоги:
вік від 25 років 
профільна технічна освіта (середня або вища) 
здатність працювати в польових умовах 
відповідальність, уважність, вмотивованість, зосередженість, стресостійкість 
готовність виконувати рутинні завдання 
здатність працювати в команді 
навички роботи з відповідним програмним забезпеченням 
сильна фізико-математична база • досвід роботи у відповідній галузі 
досвід роботи з БПЛА 
швидка реакція та вміння ухвалювати рішення в стресових ситуаціях
Умови роботи:
мобілізація до кінця воєнного стану або служба за контрактом 
можливість переведення чинних військовослужбовців з НГУ та ЗСУ через Армія+ 
можливість служби для кандидатів, які за висновком ВЛК придатні до служби у військових частинах забезпечення, ТЦК та СП, ВВНЗ, навчальних центрах тощо 
можливість служби для кандидатів зі статусом СЗЧ 
грошове забезпечення згідно з нормами чинного законодавства 
сучасне обладнання (з передовими системами озброєння та технікою) 
соціальний пакет (медичне забезпечення, пільги для військовослужбовців, підтримка сімей) 
кар'єрний розвиток (можливість зростання до сержантських та офіцерських посад) 
наставницький супровід та навчання
Обов’язки:
розробка програмного забезпечення для БПЛА з використанням Python та C++ 
робота з Ardupilot, Mission Planner, QGroundControl, Dronekit, Mavlink 
робота з Ubuntu, Raspberry Pi, OpenCV, YOLO 
робота з прошивками дронів, модулів і камер (Pixhawk, Betaflight, INAV) 
автоматизація робочих процесів (налаштування, перевірки, моніторинг) 
співпраця з техніками та пілотами для розв’язання реальних бойових задач",https://www.work.ua/jobs/7770618/,"['C++', 'Python', 'Raspberry Pi', 'Ubuntu']",80000.0,
