title,company,location,description,url,technologies,salary,level
Data Analyst,KIM Affiliates,,"KIM Affiliates — партнерська мережа, яка об'єднує рекламодавців і партнерів у вертикалях e-commerce та fintech.Ми працюємо з такими брендами як Prom.ua, PUMB, MEGOGO, Comfy, WhiteBIT, Laba та іншими.Зараз ми шукаємо Data Analyst, який допоможе нам побудувати та покращувати системну аналітику компанії.Що потрібно буде робити
будувати дашборди з ключовими бізнес-метриками 
аналізувати ефективність трафіку, офферів та партнерів 
знаходити проблеми та точки росту у даних 
працювати з SQL та базами даних 
автоматизувати збір та обробку даних 
працювати з API інтеграціями 
підтримувати скрипти на Python 
допомагати команді приймати рішення на основі даних
Що для нас важливо
досвід роботи з SQL 
досвід роботи з Python від 1 року 
досвід побудови дашбордів (Power BI / Looker Studio) 
досвід роботи з API 
сильні навички аналізу даних 
вміння знаходити інсайти у даних
Буде плюсом
досвід affiliate / CPA аналітики 
досвід роботи з BigQuery 
досвід побудови ETL процесів 
досвід роботи з n8n 
досвід роботи з маркетинговими метриками
Що ми пропонуємо
розмір заробітної плати обговорюємо окремо з кожним кандидатом в залежності від навичок та досвіду і форми співпраці 
гнучкий формат роботи (офіс / remote / hybrid) 
роботу з великими маркетинговими даними 
вплив на розвиток продукту та бізнесу
можливість різних форматів співпраці (full-time / part-time) 
цікаві бенефіти та приємні подарунки від компанії 
можливість реалізовувати цікаві проекти та отримувати досвід на різних кейсах 
Ми хочемо, щоб рішення в компанії приймалися на основі даних, а не інтуїції.Аналітик стане ключовою роллю для розвитку нашої аналітичної системи та масштабування бізнесу.",https://www.work.ua/jobs/7830162/,"['Python', 'SQL']",,
"C++, Python Developer","ФФА&K, ТОВ",Харків,"Компанія шукає розробника для створення та підтримки програмних модулів, роботи з Linux-середовищем та участі в розробці внутрішніх технічних рішень. Роль передбачає самостійну роботу з кодом, взаємодію з командою розробки та участь у розвитку продукту.Розробка та підтримка програмних компонентів, автоматизація процесів і забезпечення стабільної роботи програмного забезпечення. Тривалість проєкту становить шість місяців із можливістю переходу на постійну основу.Функціональні обов’язки
Розробка та підтримка програмних модулів на C++.
Розробка скриптів та інструментів автоматизації на Python.
Робота з Linux-системами та налаштування робочого середовища.
Робота з системою контролю.
Аналіз, виправлення помилок та покращення існуючого коду.
Взаємодія з командою розробки під час реалізації технічних задач.
Технічні вимоги
Комерційний досвід розробки на C++.
Досвід роботи з Python.
Досвід роботи з Linux.
Бекграунд у математиці або фізиці буде перевагою.
Необхідні компетенції
Самостійність у роботі та відповідальність за результат.
Здатність ефективно комунікувати в команді.
Системне мислення та уважність до деталей.
Готовність до навчання та розвитку.
Ми пропонуємо
Бронювання для працівників, які підлягають мобілізації.
Оплачувані лікарняні — до 5 днів на рік.
Офіційне працевлаштування з першого дня роботи.
Щорічна оплачувана відпустка — 24 календарні дні (згідно КЗпП). 
Стабільна заробітна плата без затримок (2 виплати на місяць).
Комфортний офіс.
Допомога з релокацією для кандидатів з інших міст.
Контакти: — email: [відгукнутися]",https://www.work.ua/jobs/7825464/,"['C++', 'Linux', 'Python']",,
Python developer,Рахівський РТЦК та СП,,"Рекрутинговий центр міста Рахів займається підбором кандидатів для проходження військової служби за контрактом.Вакансія: Python DeveloperОсновні обов’язки:
розробка та підтримка програми обліку військових засобів
розробка утилітарних програм та автоматизація процесів для ефективного управління підрозділом 
розробка, впровадження та підтримка автоматизації роботи операторів при взаємодії з військовими застосунками 
взаємодія з розробниками та іншими співробітниками для досягнення поставлених цілей
Вимоги:
вища технічна освіта
cпеціалізація в галузі інформаційних технологій, комп’ютерних наук, фізики, математики чи суміжних областей
практичний досвід розробки на Python 
базові знання роботи з Docker
базові знання роботи з реляційними БД (MySQL)
знання та досвід роботи з HTML/CSS/JS, розуміння роботи Web-застосунків та Web-сервісів
розуміння та досвід використання інструментів спільної роботи GitLab/GitHub
здатність читати та розуміти технічну документацію англійською мовою
Умови роботи:
заробітна плата від 50000 до 130000 грн
повний соціальний пакет 
безкоштовне медичне лікування
підйомна допомога за переїзд на нове місце служби
грошова допомога за укладання першого контракту
щорічна грошова допомога для оздоровлення
забезпечення сучасним обладнанням, засобами захисту, речами першої необхідності, формою, повноцінне харчування;
навчання перед вступом на посаду
Після приїзду гарантуємо Вам безкоштовне проживання, харчування, екскурсії містом, оплату дороги. Під час щорічної відпустки забезпечуємо безкоштовний відпочинок у санаторії «Гірська Тиса».Якщо ви відповідаєте вимогам вакансії, надсилайте свої резюме на електронну адресу [відгукнутися] або зателефонуйте за номером +380634116514Показати телефон (Telegram/ Viber/ Whatsapp) для отримання додаткової інформації.Будемо раді співпрацювати з Вами!",https://www.work.ua/jobs/6779329/,"['CSS', 'Docker', 'Git', 'GitHub', 'HTML', 'JavaScript', 'Python', 'SQL']",85000.0,
Automation QA Engineer (Python),"Цифрова армія, ДП МОУ",Київ,"ДП МОУ «Цифрова армія» — інноваційне державне підприємство, що трансформує оборонний сектор України через цифровізацію. Ми створюємо технологічні рішення, які працюють у військовий і мирний час, зберігаючи та розвиваючи ключову експертизу в сфері оборонних інновацій.Ми шукаємо QA Automation Engineer, який забезпечить високу якість цифрових продуктів за допомогою автоматизованого тестування. У цій ролі ви тісно співпрацюватимете з командами розробки, DevOps та manual QA, щоб створювати ефективну інфраструктуру тестування й підтримувати високу якість продуктів, важливих для безпеки держави.Вимоги: 
Впевнене знання Python для створення тестових скриптів, роботи з API, JSON, логами та автоматизації рутинних процесів.
Глибоке володіння pytest framework: побудова структури автотестів, фікстури, маркери, інтеграція з CI/CD.
Розуміння принципів роботи баз даних, уміння писати SQL-запити (SELECT, JOIN, UPDATE) для перевірки коректності даних.
Досвід автоматизації UI-тестів.
Практичний досвід тестування REST API з використанням бібліотек requests, pytest або інструментів типу Postman.
Досвід написання юнiт-тестів (pytest, unittest), використання моків, фікстур і параметризації.
Основні обовʼязки:
Розробка та підтримка автотестів (unit, API, UI) на Python.
Автоматизація тестування REST API та вебінтерфейсів (pytest).
Перевірка даних у базах через SQL-запити.
Інтеграція автотестів у CI/CD пайплайн, аналіз результатів запусків.
Співпраця з командою розробки для забезпечення якості продукту.
Що ми пропонуємо?
Роботу в команді, яка будує цифрові рішення для оборонного сектору — продукт, розробка, підтримка, аналітика;
Реальний вплив: тестування цифрових продуктів, які використовуються тисячами військових;
Участь у масштабних оборонних ІТ-проєктах з критичною важливістю для безпеки країни;
Бронювання відповідно чинному законодавству України*;
Стабільність державного підприємства з гнучкістю технологічної компанії;
Доступ до навчальних програм, міжнародних подій, конференцій.
Безпекові вимоги
Громадянство України: Кандидат повинен мати українське громадянство та готовність до перевірки державними органами (в т.ч. фоновий check, допуск до держтаємниці в перспективі);
Проходження поліграфа: Обов’язкова готовність пройти поліграф під час працевлаштування (стандартна процедура в оборонному секторі);
Конфіденційність та відповідальність: Навички роботи з чутливою (зокрема державною) інформацією, знання основ інформаційної безпеки й дотримання етичних норм.
Умови та контекст роботи
Локація: Київ
Формат роботи: Офіс
Рівень: Middle/Senior
Підпорядкування: QA Lead
Випробувальний термін: 3 місяці
Ми цінуємо вашу зацікавленість і уважно розглянемо резюме. У разі відповідності профілю надамо зворотний зв’язок.",https://www.work.ua/jobs/7251499/,"['CI/CD', 'PyTest', 'Python', 'REST API', 'SQL']",,Middle
Junior Backend Developer,Codefather,Дніпро,"👾 CODEFATHER — амбітна українська IT-компанія. 🌍Наша компанія працює на перетині технологій і творчості, розробляючи сучасні рішення для бізнесу та користувачів по всьому світу. 🖖У нас молодий, амбітний колектив, що постійно розвивається та горить своєю роботою. В компанії ви завжди знайдете підтримку, менторінг та регулярні тімбілдінги. Тому з радістю чекаємо саме на вас у нашій команді! Наші основні напрямки:💻 Software Development — Створюємо цифрові продукти в різних індустріях: Sport • Fintech • Social Network • Retail • AI Education • Agriculture • Medicine • Delivery Healthcare • Entertainment • Mobile • Real Estate • E-Commerce 🎮 GameDev — Розробляємо захопливі ігри на Unity: Casual & Hyper-Casual • Strategy • Multiplayer Educational • Racing • Card & Board • Gambling Sports • VR/AR • PC & Console 🔗 Crypto & Web3 — Будуємо blockchain-рішення майбутнього: Wallets & Payment Systems • Tokenization • KYC & AML NFT & Referral Platforms • Cross-Chain Solutions Exchanges & Analytics • DAO & Governance • DeFi & Liquidity PoolsВідкрита позиція Backend Developer, який прагне професійно зростати разом із командою та брати активну участь у розвитку backend-частини наших проєктів. Ми цінуємо ініціативність, відповідальність і вміння працювати в тісній співпраці з колегами. Працюємо в динамічному середовищі з живою комунікацією та швидким прийняттям рішень. Буде плюсом, якщо ви вже перебуваєте в Дніпрі або готові до релокації.Вимоги:
Python 3.x;

FastAPI;

Розуміння REST (HTTP-методи, статус-коди);

PostgreSQL;

SQLAlchemy, Alembic;

JWT / базова авторизація;

Інтеграція REST API (httpx / requests);

Git;

Основи асинхронності (async/await). 
Буде плюсом:
Redis;

MongoDB;

Docker / docker-compose;

Basic Linux.
Обов’язки:
Розробка та підтримка backend-сервісів на Python (FastAPI);

Робота з PostgreSQL;

Оптимізація та масштабування коду;

Написання та застосування міграцій за допомогою Alembic;

Інтеграція зовнішніх REST API;

Налаштування оточення для розробки з використанням Docker;

Робота з Git;

Виправлення багів та участь у покращенні існуючого коду;

Взаємодія з командою.
Умови роботи:
Навчання та курси професійного розвитку за потреби;
Курси англійської мови, які допоможуть у роботі;
Комфортний офіс у центрі Дніпра та команду, яка завжди підтримає;
Гнучкий графік: 09/11:00 — 18/20:00 на ваш вибір;

Можливості кар'єрного росту;

Корпоративні заходи та тімбілдинги. 
Чому Codefather? У нас ти знайдеш атмосферу відкритості, підтримки та росту. Тут можна: ✨ Реалізовувати власні ідеї 📈 Розвиватися як спеціаліст 🚀 Працювати над цікавими продуктами 🤝 Бути частиною сильної команди",https://www.work.ua/jobs/7617679/,"['Alembic', 'Docker', 'FastAPI', 'Git', 'Linux', 'MongoDB', 'PostgreSQL', 'Python', 'REST API', 'RabbitMQ', 'Redis', 'SQL', 'SQLAlchemy']",25000.0,Junior
Python Developer,Talent Foxmind,Київ,"«Українські Інфосистеми» є однією з провідних телекомунікаційних компаній України. Серед основних напрямків діяльності компанії — є надання інтегрованих послуг комерційним компаніям та державним установам. Компанія володіє великим досвідом проектування та будівництва малих і великих кабельних мереж різного напрямку: від стандартних СКМ до багаторівневих інтегрованих один в одного охоронних систем і систем автоматизації. Для підсилення команди розробників, компанія в пошуку Python Developer.Вимоги: 
Досвід роботи з Python від 2 років.
Досвід роботи з реляційними базами даних (PostgreSQL/MySQL). 
Розуміння принципів RESTful API. 
Розробка та підтримка бекенд-функціоналу для ембедед-рішень на основі Python. 
Досвід роботи з системами контролю версій (Git).
Буде плюсом:
Досвід в проектах розробки та впровадження AI/ Data Science & Machine Learning; 
Розуміння принципів роботи SLAM та досвід з Lidar-based Mapping. 
Обов’язки: 
Розробка та підтримка веб-додатків на Python. 
Створення та підтримка моделей машинного навчання для обробки просторових даних.
Інтеграція та оптимізація Data Science рішень на Python; 
Розробка нового функціонала, інтеграція зі сторонніми сервісами
Написання unit тестів 
Рефакторінг існуючого коду, за потреби
Що пропонує компанія:
Конкурентну заробітну плату та можливості кар'єрного росту;
Робота в офісі м. Київ (вул. Олешківська)
Офіційне працевлаштування;
Професійний розвиток та навчання;
Можливість бронювання в майбутньому.
Роботу у дружньому колективі та високий рівень комунікації;
Можливість впливати на проекти компанії. 
Будемо раді розглянути Ваше резюме :)",https://www.work.ua/jobs/6835279/,"['Git', 'PostgreSQL', 'Python', 'REST API', 'SQL']",,
"Junior Python Developer (AI, Django, API, Automation, Bots, Scrapers)","Мельник О.І., ФОП (IT-компанія)",,"Хочеш писати код, який автоматизує роботу бізнесів, створювати парсери, ботів, інтеграції з API та розробляти проекти на Django? Ми шукаємо Junior Python Developer у напрямку автоматизації та веб-розробки.Що ми очікуємо:
Знання Python і розуміння принципів ООП
Навички роботи з Django (проекти з нуля, підтримка існуючих, робота з БД)
Досвід у бібліотеках для збору даних: Selenium, Playwright, BeautifulSoup, Scrapy, Requests
Розуміння роботи з API та веб-запитами
Інтерес до створення ботів (Telegram, Discord або інші)
Приклади власних проектів (GitHub або інші посилання)
Твої задачі:
Розробка парсерів для збору та обробки даних з різних джерел
Створення ботів для автоматизації завдань
Інтеграції з різними API (маркетплейси, соцмережі, сервіси)
Автоматизація бізнес-процесів і повторюваних рутинних завдань
Розробка проектів на Django з нуля: сайти, внутрішні сервіси, дашборди, CRM
Підтримка та розвиток існуючих Django-проектів
Оптимізація та вдосконалення скриптів і бекенду
Ми пропонуємо:
Повний робочий день (8 годин), Пн-Пт
За бажанням: гнучкий графік (можна підлаштувати початок/кінець дня)
За потреби: можливість роботи на півставки (part-time)
Роботу в команді, яка спеціалізується на автоматизації, парсерах, ботах та Django-проектах
Наставництво: допоможемо прокачати навички, дамо навчальні ресурси, проводимо код-рев'ю
Реальні задачі з першого дня, де твій код одразу приносить користь
Якщо ти ще не маєш комерційного досвіду або не знайомий з окремими технологіями зі списку, але володієш міцними базовими знаннями та маєш сильне бажання швидко навчатися і розвиватися у сфері автоматизації та веб-розробки — пиши нам, і ми обов’язково розглянемо твою кандидатуру!",https://www.work.ua/jobs/7208953/,"['Beautiful Soup', 'Django', 'Git', 'GitHub', 'Python', 'REST API', 'Scrapy', 'Selenium']",25000.0,Junior
