title,company,location,description,url,technologies,salary,level
Інженер-програміст,Universal Bank,Київ,"Universal Bank є сучасним українським банком зі стабільною репутацією протягом 30 років. Наш банк відомий завдяки успішному інноваційному проєкту monobank, спільному роздрібному продукту Universal Bank у співпраці з IT-компанією Fintech Band, яким активно користуються вже понад 10 мільйонів клієнтів.Ваші основні обов’язки:
Підтримка існуючих програмно-технічних комплексів Банку. 
Приймати участь у проєктах по розвитку існуючих та впровадження нових ПТК.
Аналіз бізнес вимог та технічних завдань.
Складання звітів по виконаній роботі.
Що ми очікуємо від Вас:
Знання принципів роботи об'єктно-орієнтованого програмування, Rest-Ful API.
Володіння мовою програмування Python.
Знання бібліотек Flask, FastAPI, pyodbc, sqlalchemy.
Розуміння мережевих протоколів та інфраструктури.
Володіння мережевими технологіями (IP, порти, проксі) та вміння реалізовувати мережеву взаємодію у Python з використанням requests/aiohttp.
Досвід створення та програмування Viber/Telegram ботів.
​Досвід програмування з використанням штучного інтелекту (бажано Claude Code від Anthropic).
Буде плюсом:
Робота в ІТ в фінансових установах.
Робота з банківськими системами. 
Участь у проєктах по автоматизації процесів фінансових установ. 
Знання принципів роботи з Docker, GIT.
Знання JavaScript та фреймфорку React.
Чому кандидати обирають Універсал Банк: Люди — наш головний капітал. Успіх банку — тисячі особистих та професійних успіхів кожного. Коли розвиваються співробітники — розвивається Універсал Банк.Приєднуючись до команди професіоналів Універсал Банку Ви отримаєте:
Офіційне працевлаштування з першого робочого дня.
Стабільний графік роботи — 5/2 з 9:00 до 18:00.
Швидку адаптацію в команді професіоналів, готових ділитися досвідом, навчати та підтримувати з першого дня.
Турбота про Ваше здоров’я — в нашому Банку діє програма медичного страхування співробітників.
Розвиток та можливість кар'єрного росту всередині Банку — відвідуйте тренінги та конференції, обмінюючись досвідом з колегами.
Додаткову винагороду за виконання обов’язків тимчасово відсутнього працівника — Ваше вміння допомагати колегам буде щедро винагороджене.
Корпоративні подарунки — від нас з любов’ю до наших працівників.
Цінуючи ваш вклад у розвиток компанії, ми надаємо після року роботи картку Platinum від monobank із преміальним сервісом та без жодних витрат на обслуговування.
Корпоративну бібліотеку: зануритесь у світ знань та невичерпного розвитку.
Надсилайте свої резюме або телефонуйте/пишіть за деталями 0676435158Показати телефон(Лілія — рекрутер)",https://www.work.ua/jobs/7797138/,"['Docker', 'FastAPI', 'Flask', 'Git', 'JavaScript', 'Python', 'REST API', 'React', 'SQL', 'SQLAlchemy']",,
"Senior Odoo Developer, Tech Lead",Meest,,"Meest Пошта — провідний український поштово-логістичний оператор, що надає послуги доставки посилок, документів та вантажів по Україні та за кордон, запрошує до своєї команди досвідченого та проактивного Senior Odoo Developer / Tech Lead.Ми шукаємо системного та технічно сильного спеціаліста, який стане ключовою фігурою в розвитку ERP-напрямку та забезпечить якісну архітектуру, масштабованість рішень і стабільність розробки.У цій ролі ви працюватимете над розвитком внутрішніх бізнес-систем, автоматизацією процесів та інтеграційними рішеннями на базі Odoo, а також братимете участь у проєктуванні нових модулів і вдосконаленні технічних процесів.Локація: Київ / Львів / віддалено (обговорюється)Основні задачі
Проєктування архітектури Odoo-модулів
Розробка та підтримка custom modules
Оптимізація продуктивності
Проєктування та реалізація REST API
Участь у frontend-частині (Owl, QWeb, XML views)
Code review та впровадження стандартів якості
Менторинг розробників
Впровадження тестування (unit, integration)
Документування архітектури та API
Участь у побудові CI/CD та deployment процесів
ВимогиOdoo
3+ років комерційного досвіду з Odoo (версії 15+)
Глибоке розуміння Odoo ORM та модульної архітектури
Досвід performance optimization
Backend
5+ років комерційного досвіду з Python (3.8+)
Впевнена робота з PostgreSQL (оптимізація запитів, індекси)
Досвід проєктування REST API
Розуміння design patterns та мікросервісної архітектури
Full Stack
JavaScript (Owl framework)
QWeb templates, XML views
DevOps
Docker
CI/CD pipelines
Git branching strategies
Розуміння deployment, monitoring та logging процесів
Буде перевагою
Досвід роботи з Odoo.sh
Message brokers: RabbitMQ, Apache Kafka
Досвід великих Odoo-імплементацій
Contributions в Odoo community / open source
Досвід з іншими ERP-системами
Англійська Upper-Intermediate+
Кого ми шукаємо
Senior або Tech Lead з реальним досвідом у Odoo
Людину, яка може самостійно проєктувати рішення
Сильний technical mindset та системне мислення
Готовність до mentoring
Проактивний підхід та відповідальність за результат
Приєднуйтесь до нашої команди та застосуйте свій досвід і технічну експертизу, щоб розвивати та масштабувати міжнародні продукти Meest Пошта! 🚀",https://www.work.ua/jobs/7768752/,"['CI/CD', 'Docker', 'Git', 'JavaScript', 'Odoo', 'PostgreSQL', 'Python', 'REST API', 'RabbitMQ', 'SQL']",,Senior
"Викладач, ментор курсів Python",CyberBionic Systematics,,"CyberBionic Systematics — освітній ІТ-центр, який понад 15 років навчає програмуванню. Шукаємо Python-розробника, який готовий ділитися знаннями зі студентами в ролі викладача курсу «Python».Вимоги
Досвід комерційної розробки на Python від 2 років
Впевнене володіння Python 3, Django та web-фреймворками
Знання ООП, SQLite, Git
Вміння пояснювати складні речі простими словами
Досвід викладання чи менторства буде перевагою
Завдання
Проведення онлайн-занять (2−3 рази на тиждень по 2 години)
Навчання групи від старту курсу до отримання сертифіката
Надання зворотного зв’язку студентам
Проведення вебінарів (за бажанням)
Ми пропонуємо
Гнучкий графік і можливість поєднувати з основною роботою
Дистанційний формат
Готові навчальні матеріали для занять
Перевірку домашніх завдань виконує асистент
Підтримку HR-команди у працевлаштуванні студентів
Можливість безкоштовно навчатись у колег і прокачувати свої навички
Чому це може бути цікаво вам
Структурування та поглиблення власних знань
Досвід публічних виступів і розвиток особистого бренду
Участь у методологічних проєктах
📩 Якщо вам цікаво — пишіть у Telegram: @hr_cbs. Ми відповідаємо протягом 2 робочих днів. CyberBionic Systematics — https://edu.cbsystematics.com",https://www.work.ua/jobs/4799664/,"['Django', 'Git', 'Python', 'SQL', 'SQLite']",,
Розробник Odoo (Python),Всеукраїнські системи управління,,"Маєш досвід роботи розробником Odoo? Прагнеш працювати з сучасними бізнес-рішеннями, не просто писати код, а допомагати бізнесу зростати завдяки якісним технологіям? Тоді ця вакансія саме для тебе!Хто ми? Ми — проектна ІТ-компанія «Всеукраїнські системи управління». Наша місія — допомагати бізнесу адаптуватися та процвітати, навіть у складні часи. Ми впроваджуємо, налаштовуємо та підтримуємо сучасні системи управління, такі як BAS, Odoo, Bimp та іншіЩо ми пропонуємо?🔷 Конкурентну оплату праці — обговорюється індивідуально 🔷 Гнучкий графік з можливістю часткової зайнятості 🔷 Цікаві проєкти — кожен з них унікальний 🔷 Віддалений формат роботи — працюй там, де тобі зручно 🔷 Професійний розвиток — вдосконалюй свої навички та отримуй новий досвід 🔷 Дружню атмосферу — колектив, де твої ідеї та зусилля цінують🎯 Можливість працювати з перспективною європейською ERP-системою Odoo та адаптувати її для українських реалійЩо ти будеш робити?
Розгортання, налаштування та підтримка системи Odoo
Розробка та інтеграція модулів Odoo для вирішення бізнес-завдань
Адміністрування серверів, баз даних та забезпечення їхньої безпеки
Робота з інтеграціями (1С, IP телефонія, месенджери, соцмережі)
Створення кастомних модулів і доопрацювання існуючих
Що важливо для нас?
Досвід роботи з Odoo та Python
Розуміння автоматизації бізнесу
Знання HTML, CSS, JavaScript та досвід створення модулів для Odoo
Досвід роботи з Git, PostgreSQL та API 
Навички роботи в Linux
Базові знання англійської для роботи з технічною документацією
Разом із нами ти: 🔷Будеш працювати над сучасними проєктами 🔷Здобудеш досвід роботи з передовими технологіями 🔷 Відчуєш себе частиною команди, яка цінує кожногоБільше про нас —vsu.biz.ua✨ Ми чекаємо саме на тебе, щоб разом досягати нових вершин!",https://www.work.ua/jobs/6051432/,"['CSS', 'Git', 'HTML', 'JavaScript', 'Linux', 'Odoo', 'PostgreSQL', 'Python', 'SQL']",,
"Спеціаліст з дослідження даних, Data scientist у Глобине","Глобино, ГК",,"Група компаній «Глобино»— провідний виробник ковбасних, м’ясних та молочних виробів на ринку України, що об'єднує підприємства харчової промисловості, які забезпечують замкнутий виробничий цикл та продажі готової продукції.У зв’язку з розширення відділу запрошуємо у нашу командуспеціаліста з дослідження даних Data scientist/ Data Analyst .Наші очікування від кандидата:
Знання Python/PL SQL/Oracle.
Алгоритми Machine Learning.
Розуміння базової статистики та метрик якості моделей.
Технології візуалізації даних і звітності.
Аналітичне мислення.
Обов’язки: 
Дослідження та аналіз даних підприємства, структурування інформації з різних джерел.
Пошук прихованих закономірностей, розробка та підтримка моделей прогнозування.
Створення алгоритмів, що дозволяють системам навчатися та приймати рішення.
Написання та/або внесення змін у SQL-запити для вивантаження аналітичних даних
впровадження моделей у ERP.
Візуалізація результатів в зручній для користувачів формах.
Ми пропонуємо:
Стабільність: офіційне працевлаштування та повний соціальний пакет.
Винагорода: вчасна та прозора виплата заробітної плати.
Робоче місце: комфортний офіс у м. Глобине.
Розвиток: можливість працювати над складними та цікавими задачами у великій компанії.
Бронювання: за умови дійсних військо-облікових документів.
Вакансія в нашій компанії — це чудова можливість приєднатися до професійної та інноваційної команди, яка продає якісну та безпечну продукцію під брендом «Глобино», виробництво якої базується на кращих традиціях і досвіді минулого з використанням передових технологій і інновацій.Якщо все це про Вас і Ви бажаєш стати частиною нашого великого колективу — робіть відгук та надсилайте резюме або телефонуйте!Більш детально познайомитися з компанією Ви можете за посиланнями:https://corp.globino.ua/",https://www.work.ua/jobs/7687294/,"['Oracle', 'Python', 'SQL']",,
AI Software Engineer (Python/LLM),"Українська енергетична біржа, ТОВ",,"Про компанію: ТОВ «Українська енергетична біржа» є лідером серед товарних бірж України, що здійснює організацію та проведення електронних біржових торгів (аукціонів) всіма видами енергоресурсів та забезпечує їх прозорість і чесність. Компанія відіграє ключову роль у забезпеченні ефективності та стійкості енергетичного сектору України.Ми розвиваємо окремий напрямок цифрових продуктів, спрямований на підвищення ефективності внутрішніх процесів та створення інтелектуальних інструментів для роботи з даними. Про роль: Ми запускаємо новий стратегічний напрям — розвиток AI-рішень для оптимізації бізнес-процесів компанії та створення інтелектуальних інструментів для роботи з даними.Шукаємо AI Software Engineer, який допоможе побудувати архітектуру AI-рішень з нуля, розробляти та впроваджувати моделі машинного навчання, а також інтегрувати їх у внутрішні системи компанії.Це роль для сильного інженера, який розуміє не лише алгоритми машинного навчання, а й повний життєвий цикл розробки програмного забезпечення та архітектуру production-систем.Робота передбачає тісну взаємодію з AI Product Manager, DevOps-командою та технічними спеціалістами для створення масштабованих AI-рішень. Ключові обов’язки та компетенції:
Проектування, розробка та деплой AI-моделей для вирішення бізнес-задач компанії
Розробка та налаштування (fine-tuning) великих мовних моделей (LLM) для корпоративних сценаріїв використання
Побудова та оптимізаціяRAG-архітектур
Оптимізація швидкості роботи моделей (latency) та вартості запитів (cost per token)
Забезпечення масштабованості та стабільності AI-сервісів у production-середовищі
Співпраця з AI Product Manager для реалізації функціоналу відповідно до бізнес-вимог та SRS
Спільна робота з DevOps-командою для побудови та підтримки MLOps-процесів
Ведення технічної документації щодо архітектури рішень та розробленого коду 
Наш ідеальний кандидат:
Має практичний досвід розробки на Python у задачах машинного навчання або AI
Має практичний досвід роботи з ML-фреймворками (PyTorch, TensorFlow)
Має досвід роботи з LLM та розуміє архітектуру Transformer
Має досвід fine-tuning моделей та побудови RAG-систем
Працював з LangChain,LlamaIndex або аналогічними інструментами
Має досвід роботи з векторними базами даних (Pinecone, Weaviate, Milvus або аналогами)
Розуміє принципи MLOps, CI/CD, має досвід роботи з Docker / Kubernetes
Вміє писати чистий, підтримуваний код та документувати технічні рішення
Має критичне мислення та вміє аргументувати архітектурні рішення
Орієнтується набізнес-результат, а не лише технічну реалізацію
Вміє працювати самостійно та без мікроменеджменту 
Буде перевагою:
вища технічна освіта (Комп'ютерні науки, Прикладна математика, Штучний інтелект або суміжні напрямки) 
Ми пропонуємо:
Роботу над новим стратегічним напрямком AI-розробки
Вплив на розвиток продуктів та внутрішніх систем компанії
Повністю віддалений формат роботи.
Фінансова стабільність. Конкурентний рівень заробітної плати та своєчасна виплата.
Можливості для розвитку та кар'єрного зростання.
Графік роботи: з понеділка по п’ятницю, 8-ми годинний робочий день з 08.30/09:00 -17.30/18:00
Відпустки та лікарняні: 24 календарні дні відпустки для відновлення сил а також оплачувані лікарняні.
Адаптація та підтримка. У нас є база професійних знань та Політик, постійна підтримка з боку керівництва та колег, особливо — на адаптаційному періоді. Детальну інформацію про компанію можна переглянути за посиланням: https://www.ueex.com.ua/ueex/about-us/  Шукаєте можливість реалізувати свій досвід у професійній команді? Надсилайте резюме — будемо раді познайомитися та обговорити співпрацю!",https://www.work.ua/jobs/7768869/,"['CI/CD', 'Docker', 'Kubernetes', 'LangChain', 'PyTorch', 'Python', 'TensorFlow']",,Senior
